{
  "schema_version": "1.0",
  "run_id": "36bb6c7b-bea3-4f95-9d1f-621ef1565f67",
  "created_at_utc": "2026-08-30T22:49:57.086730+00:00",
  "protocol": "cv",
  "fold": "fold-3",
  "repository": "tensorflow/tensorflow",
  "seed": 42,
  "model": {
    "name": "p2_ft__sub-off__lr-1.0__wng-2",
    "config": {
      "experiment": {
        "seed": 42,
        "n_splits": 5,
        "text_fields": [
          "title",
          "body"
        ]
      },
      "model": {
        "dim": 100,
        "lr": 1.0,
        "epoch": 25,
        "word_ngrams": 2,
        "min_count": 1,
        "minn": 0,
        "maxn": 0,
        "bucket": 200000,
        "loss": "softmax"
      },
      "backend": {
        "library": "fasttext",
        "version": "0.9.2"
      },
      "score_semantics": "probability"
    }
  },
  "data": {
    "upstream_commit": "2927bc67eb42db8affd16eaf3e5a6d74f3063961",
    "train_size": 240,
    "test_size": 60,
    "train_fingerprint": "644483881d0fbe56d183c9721629908062c0b38692d2acc0a0c7ed8bf7143c35",
    "test_fingerprint": "845850ab6474dec87629dd27b597917021c7a586cf460556b9197bf4153a1b4b"
  },
  "classes": [
    "bug",
    "feature",
    "question"
  ],
  "metrics": {
    "per_class": {
      "bug": {
        "precision": 0.8823529411764706,
        "recall": 0.75,
        "f1-score": 0.8108108108108109,
        "support": 20.0
      },
      "feature": {
        "precision": 0.6923076923076923,
        "recall": 0.9,
        "f1-score": 0.782608695652174,
        "support": 20.0
      },
      "question": {
        "precision": 0.8823529411764706,
        "recall": 0.75,
        "f1-score": 0.8108108108108109,
        "support": 20.0
      }
    },
    "macro_average": {
      "precision": 0.8190045248868779,
      "recall": 0.7999999999999999,
      "f1-score": 0.8014101057579319,
      "support": 60.0
    },
    "weighted_average": {
      "precision": 0.8190045248868779,
      "recall": 0.8,
      "f1-score": 0.8014101057579318,
      "support": 60.0
    },
    "accuracy": 0.8,
    "confusion_matrix": [
      [
        15,
        4,
        1
      ],
      [
        1,
        18,
        1
      ],
      [
        1,
        4,
        15
      ]
    ]
  },
  "resources": {
    "fit": {
      "elapsed_seconds": 0.6484824000071967,
      "rss_before_mb": 147.02734375,
      "rss_after_mb": 341.359375,
      "rss_delta_mb": 194.33203125,
      "python_peak_mb": 5.136831283569336
    },
    "inference": {
      "elapsed_seconds": 0.010501099997782148,
      "rss_before_mb": 341.359375,
      "rss_after_mb": 341.359375,
      "rss_delta_mb": 0.0,
      "python_peak_mb": 0.32977867126464844
    }
  },
  "predictions": {
    "y_true": [
      "question",
      "question",
      "question",
      "question",
      "question",
      "question",
      "question",
      "question",
      "question",
      "question",
      "question",
      "question",
      "question",
      "question",
      "question",
      "question",
      "question",
      "question",
      "question",
      "question",
      "feature",
      "feature",
      "feature",
      "feature",
      "feature",
      "feature",
      "feature",
      "feature",
      "feature",
      "feature",
      "feature",
      "feature",
      "feature",
      "feature",
      "feature",
      "feature",
      "feature",
      "feature",
      "feature",
      "feature",
      "bug",
      "bug",
      "bug",
      "bug",
      "bug",
      "bug",
      "bug",
      "bug",
      "bug",
      "bug",
      "bug",
      "bug",
      "bug",
      "bug",
      "bug",
      "bug",
      "bug",
      "bug",
      "bug",
      "bug"
    ],
    "y_pred": [
      "question",
      "question",
      "question",
      "question",
      "bug",
      "question",
      "feature",
      "feature",
      "question",
      "question",
      "feature",
      "question",
      "question",
      "question",
      "question",
      "question",
      "question",
      "question",
      "feature",
      "question",
      "feature",
      "bug",
      "feature",
      "feature",
      "question",
      "feature",
      "feature",
      "feature",
      "feature",
      "feature",
      "feature",
      "feature",
      "feature",
      "feature",
      "feature",
      "feature",
      "feature",
      "feature",
      "feature",
      "feature",
      "bug",
      "bug",
      "feature",
      "bug",
      "bug",
      "bug",
      "bug",
      "bug",
      "bug",
      "bug",
      "bug",
      "bug",
      "feature",
      "bug",
      "bug",
      "bug",
      "feature",
      "feature",
      "question",
      "bug"
    ],
    "scores": [
      [
        0.33118656277656555,
        0.301483690738678,
        0.3673596978187561
      ],
      [
        0.002162618562579155,
        0.2685868740081787,
        0.7292805314064026
      ],
      [
        0.002640350954607129,
        0.4173494875431061,
        0.5800401568412781
      ],
      [
        0.016094623133540154,
        0.4637046456336975,
        0.520230770111084
      ],
      [
        0.6222051382064819,
        0.11984854191541672,
        0.25797635316848755
      ],
      [
        0.26055803894996643,
        0.22146786749362946,
        0.5180041193962097
      ],
      [
        0.004250775557011366,
        0.5211212635040283,
        0.4746580123901367
      ],
      [
        0.14791293442249298,
        0.4610629081726074,
        0.3910541832447052
      ],
      [
        0.0005572487134486437,
        0.3271822929382324,
        0.6722904443740845
      ],
      [
        0.3053976595401764,
        0.24205465614795685,
        0.45257771015167236
      ],
      [
        0.01798088662326336,
        0.49429118633270264,
        0.4877578914165497
      ],
      [
        0.028139017522335052,
        0.37830865383148193,
        0.5935823321342468
      ],
      [
        0.0707554817199707,
        0.3822450339794159,
        0.5470294952392578
      ],
      [
        0.037381019443273544,
        0.4328482449054718,
        0.5298007130622864
      ],
      [
        0.03469844534993172,
        0.4324246346950531,
        0.5329069495201111
      ],
      [
        0.005851032678037882,
        0.31709617376327515,
        0.6770827770233154
      ],
      [
        0.27006879448890686,
        0.20520491898059845,
        0.5247563123703003
      ],
      [
        0.039976343512535095,
        0.35420525074005127,
        0.6058484315872192
      ],
      [
        0.0008134106174111366,
        0.6088399887084961,
        0.3903765380382538
      ],
      [
        0.01894696243107319,
        0.47331923246383667,
        0.5077638030052185
      ],
      [
        0.019246062263846397,
        0.6716486215591431,
        0.30913522839546204
      ],
      [
        0.8742471933364868,
        0.030844127759337425,
        0.0949387177824974
      ],
      [
        0.00510683748871088,
        0.6073548197746277,
        0.3875683844089508
      ],
      [
        0.08382776379585266,
        0.4613857567310333,
        0.4548164904117584
      ],
      [
        0.03485351800918579,
        0.3762638568878174,
        0.5889126062393188
      ],
      [
        0.195363387465477,
        0.41098928451538086,
        0.39367735385894775
      ],
      [
        0.0983625054359436,
        0.5322303771972656,
        0.3694371283054352
      ],
      [
        0.002723154379054904,
        0.6516979336738586,
        0.3456089496612549
      ],
      [
        0.001777555444277823,
        0.7724169492721558,
        0.22583553194999695
      ],
      [
        0.0009498557774350047,
        0.8066640496253967,
        0.19241616129875183
      ],
      [
        0.00032388008548878133,
        0.6948485970497131,
        0.3048575818538666
      ],
      [
        0.0011500458931550384,
        0.7568418979644775,
        0.24203802645206451
      ],
      [
        0.006043878383934498,
        0.7091981768608093,
        0.28478795289993286
      ],
      [
        0.012381079606711864,
        0.5391025543212891,
        0.4485463798046112
      ],
      [
        0.004811987280845642,
        0.6649430990219116,
        0.3302748203277588
      ],
      [
        0.0006534414133056998,
        0.7828168272972107,
        0.21655970811843872
      ],
      [
        0.0018856209935620427,
        0.7612776160240173,
        0.23686674237251282
      ],
      [
        0.0041117542423307896,
        0.8691978454589844,
        0.12672044336795807
      ],
      [
        0.0024021510034799576,
        0.878789484500885,
        0.11883838474750519
      ],
      [
        0.005795528646558523,
        0.6446247100830078,
        0.3496098220348358
      ],
      [
        0.9782392382621765,
        0.005947606638073921,
        0.015843119472265244
      ],
      [
        0.5793839693069458,
        0.1772482991218567,
        0.24339774250984192
      ],
      [
        0.027487361803650856,
        0.6040042042732239,
        0.368538498878479
      ],
      [
        0.9976409673690796,
        0.0008558229892514646,
        0.0015332644106820226
      ],
      [
        0.8357510566711426,
        0.04477551206946373,
        0.11950340867042542
      ],
      [
        0.5503870844841003,
        0.1852821409702301,
        0.26436081528663635
      ],
      [
        0.9722322821617126,
        0.01349080353975296,
        0.014306924305856228
      ],
      [
        0.9708272814750671,
        0.013746269978582859,
        0.01545643713325262
      ],
      [
        0.3951193392276764,
        0.2792509198188782,
        0.32565972208976746
      ],
      [
        0.9997120499610901,
        6.383053550962359e-05,
        0.00025405207998119295
      ],
      [
        0.9992251396179199,
        0.00017926607688423246,
        0.0006255327607505023
      ],
      [
        0.9265645742416382,
        0.028625482693314552,
        0.044839877635240555